artista,biografia,oyentes,reproducciones,artistas_similares
Popular,"1) Dom Chronicles

2) Incorrect spelling for Hungarian synthpop band: Populär <a href=""https://www.last.fm/music/Popular"">Read more on Last.fm</a>",5861,30594,"['Gaunod', ""Chœur des moines de l'Abbaye Saint-Pierre de Solesmes"", 'Stanleey Myers', 'Benedettini Abbazia di San Paolo fuori le mura', 'StereOhio']"
Kings of Leon,"Kings of Leon is an American rock band formed in Nashville, Tennessee, in 1999. The band is composed of brothers Caleb, Nathan and Jared Followill, and their cousin Matthew Followill. The band's early music was a blend of Southern rock and garage rock with blues influences, but it has evolved throughout the years to include a variety of genres and a more alternative, arena rock sound. Kings of Leon achieved initial success in the United Kingdom with nine Top 40 singles <a href=""https://www.last.fm/music/Kings+of+Leon"">Read more on Last.fm</a>",4589802,213489340,"['The Killers', 'Cold War Kids', 'Kasabian', 'Razorlight', 'The Black Keys']"
TV Girl,"TV Girl are a Los Angeles-based American band consisting of Brad Petering, Jason Wyman, and Wyatt Harmon. The band describes their music as pop and something ""you can sing along to, but wouldn't sing around your parents"".  TV Girl's Todd Rundgren sampling song ""If You Want It"" gained traction on the internet and became popular enough for Warner Music Group to take notice and take it down. <a href=""https://www.last.fm/music/TV+Girl"">Read more on Last.fm</a>",2236379,206890994,"['Jordana', 'Eyedress', 'Strawberry Guy', 'VACATIONS', 'Roar']"
Mr.B The Gentleman Rhymer,"Mr.B The Gentleman Rhymer is a UK received pronunciation hip-hop / acid house artist, producing chap-hop, acid ragtime, etc.

Having spent the best part of a decade bringing some manners back to popular culture, this dopest of fellows endeavours to entertain and amuse, with his ingenious stylings.

Aiming to dazzle with dignity, Mr.B takes to the stage with his banjolele and stiff upper lip to perform ditties of pipe-smoking, high society, cricket and sexual misadventure <a href=""https://www.last.fm/music/Mr.B+The+Gentleman+Rhymer"">Read more on Last.fm</a>",26907,528157,"['George Formby', 'Dan Bull', 'Mr Weebl', 'Professor Elemental', 'Monty Python']"
Mos Def,"Dante Terrell Smith (born December 11, 1973 in Brooklyn, New York, United States), now known by the stage name Yasiin Bey (formerly Mos Def), is a Grammy Award-nominated rapper and actor. He now works under the nom de plum Yasiin Bey, and has performed under the aliases Mighty Mos Def, The Freaky Night Watchman, Boogie Man, Black Dante and Pretty Flaco. He began rapping in a group called Urban Thermo Dynamics in 1994, and then formed the duo Black Star with Talib Kweli in 1998. <a href=""https://www.last.fm/music/Mos+Def"">Read more on Last.fm</a>",1494519,33028840,"['Black Star', 'The Roots', 'A Tribe Called Quest', 'Common', 'Talib Kweli']"
Selena Gomez & The Scene,"Selena Gomez & the Scene was an American pop rock band from Los Angeles, California. Formed in 2008, its last lineup consisted of lead vocalist Selena Gomez, bassist Joey Clement, drummer Greg Garman, keyboardist Dane Forrest and guitarist Drew Taubenfeld. The band released three studio albums, seven singles and nine music videos.

Their debut album, Kiss & Tell, was released on September 29, 2009, debuting at No. 9 on the US Billboard 200 and earning <a href=""https://www.last.fm/music/Selena+Gomez+&+the+Scene"">Read more on Last.fm</a>",2093471,41405876,"['Selena Gomez', 'Ashley Tisdale', 'Hannah Montana', 'Bridgit Mendler', 'Vanessa Hudgens']"
Muse,"Muse is an English rock band from Teignmouth, Devon, formed in 1994. The band consists of Matt Bellamy (lead vocals, guitar, keyboards), Chris Wolstenholme (bass guitar, backing vocals), and Dominic Howard (drums). They released their debut album, Showbiz, in 1999, showcasing Bellamy's falsetto and a melancholic alternative rock style. Their second album, Origin of Symmetry (2001), incorporated wider instrumentation and romantic classical influences and earned them a reputation for energetic live performances. <a href=""https://www.last.fm/music/Muse"">Read more on Last.fm</a>",5547308,454590463,"['Royal Blood', 'Nothing But Thieves', 'Placebo', 'Radiohead', 'Franz Ferdinand']"
Driving Mrs. Satan,"Driving Mrs. Satan is a London/Naples-based acoustic trio playing heavy metal classics in a folk pop style.

Popscotch is Driving Mrs. Satan’s debut album, comprised of acoustic cover songs by Metallica, Iron Maiden, Helloween and many others, performed with clear female vocals, acoustic guitars and double bass. <a href=""https://www.last.fm/music/Driving+Mrs.+Satan"">Read more on Last.fm</a>",1663,33822,"['We Invented Paris', 'Eva & Manu', 'Holy Moly & The Crackers', 'Woodlands', 'Rob Lynch']"
HipHop Mali," <a href=""https://www.last.fm/music/HipHop+Mali"">Read more on Last.fm</a>",0,0,[]
Uffie,"Anna-Catherine Hartley (born December 9, 1987), known professionally as Uffie, is an American-French singer, songwriter, rapper, DJ, and fashion designer formerly signed to French electronic music record label Ed Banger Records. Uffie's music incorporates synthpop, acid house, alternative dance, and ""somewhere between electro, rap and nu skool"". Her music is said to have ""had a lasting and widespread influence in the 2010s"" . 

She was born in Miami, raised in Hong Kong and now lives in Paris. <a href=""https://www.last.fm/music/Uffie"">Read more on Last.fm</a>",562876,9140387,"['Mr. Oizo', 'Sebastian', 'Nadia Oh', 'Peaches', 'Busy P']"
Bondage Fairies,"Bondage Fairies is a ""nintendo-death-punk"" band that formed in Stockholm, Sweden. They are named after a Japanese hentai graphic novel.
The band consists of Elvis Creep (lead vocals, guitar, synthesizer) and Deus Deceptor (vocals, bass, synthesizer). The duo came together in 2001, Elvis after being rejected from art school, and Deus being a budding computer scientist.
They always wear masks on-stage and in pictures, which they say are inspired on japanese robots and robots from the seventies. <a href=""https://www.last.fm/music/Bondage+Fairies"">Read more on Last.fm</a>",123204,6730984,"['Gidropony', 'FUCKING WEREWOLF ASSO', 'Uncle Outrage', 'Tex Taiwan', 'шумные и угрожающие выходки']"
Chaos Conspiracy," <a href=""https://www.last.fm/music/+noredirect/Chaos+Conspiracy"">Read more on Last.fm</a>",16,147,[]
John Kite,"John Kite is a musician from Grand Rapids, Michigan. He has been performing Rockabilly music for more than twenty years with various back up members.  <a href=""https://www.last.fm/music/John+Kite"">Read more on Last.fm</a>",56,527,"['Tom Hoekstra', 'Carl Hauck', 'Holcombe Waller', 'A.K.A Prince', 'Jesse Nesbitt']"
Space 2000," <a href=""https://www.last.fm/music/Space+2000"">Read more on Last.fm</a>",1927,7212,"['Miles Inc.', 'Gerard Hendri', 'John Westbourne', 'Wayra', 'Mindfillers']"
HipHop Brazil," <a href=""https://www.last.fm/music/HipHop+Brazil"">Read more on Last.fm</a>",6,67,[]
A.R. Rahman,"Allah Rakha Rahman (Tamil: அல்லா ரக்கா ரஹ்மான்; known professionally as A.R. Rahman; Tamil: ஏ. ஆர். ரகுமான், born 6 January 1966 in Chennai, India as A. S. Dileep Kumar) is an Indian film composer, record producer, musician, singer and philanthropist. Described as the world's most prominent and prolific film composer by Time, his works are notable for integrating eastern classical music with electronic music sounds, world music genres and traditional orchestral arrangements. <a href=""https://www.last.fm/music/A.R.+Rahman"">Read more on Last.fm</a>",651004,14786281,"['Shankar-Ehsaan-Loy', 'Pritam', 'Vishal-Shekhar', 'Amit Trivedi', 'Yuvan Shankar Raja']"
Paul Otten," <a href=""https://www.last.fm/music/Paul+Otten"">Read more on Last.fm</a>",15936,77140,"['Alex & Sam', 'Ellem', 'Emily Bell', 'The Hot Damns', 'The Kicks']"
Ricky Rollins," <a href=""https://www.last.fm/music/Ricky+Rollins"">Read more on Last.fm</a>",41,82,[]
Matthew Harris," <a href=""https://www.last.fm/music/Matthew+Harris"">Read more on Last.fm</a>",2014,8703,"['Jake Runestad', 'Robert Applebaum', 'Richard Burchard', 'Stephen Chatman', 'Harry Burleigh']"
Anno Domini Beats,"Anno Domini Beats (http://annodominination.com) is one of the most renowned underground Hip Hop production companies worldwide. As CEO of the Anno Domini Beats movement, Anno Domini has achieved over 100 million recorded song plays on the Internet since 2004, topping download charts on the regular and winning numerous awards and accolades including the 2006 International Songwriting Competition in the Hip Hop and R&B category and being nominated as a finalist for the 2010 Enterprising Young Brit Awards in the Creative category.  <a href=""https://www.last.fm/music/Anno+Domini+Beats"">Read more on Last.fm</a>",20002,291652,"['Allrounda Productions', 'Malefique', 'Ритмо', 'РЖБ', 'katano beat']"
Los Reales," <a href=""https://www.last.fm/music/Los+Reales"">Read more on Last.fm</a>",450,1980,"['Benitez y Valencia', 'Olimpo Cardenas', 'Carlos Cuevas', 'Yordano', 'Pepe Jaramillo']"
Majk Spirit,"Majk Spirit, Bratislava, Slovakia je slovenský hudobný umelec (žáner: Rap), ktorý patrí do Bratislavskej skupiny H16. Interpret, ktorý je jediným autorom vlastných textov, pôsobí na slovenskej hudobnej scéne od roku 2000. Prvé skladby vydal pod pseudonymom Dilema, neskôr so svojou skupinou mal s ďalším umeleckým menom “Koko Šajs” ale aj “Koko Najs” leví podieľ na úspechoch albumov “Jednašestka ftvojom klube” (2004), “Kvalitný materiál” (2006) a “Čísla nepustia” (2008), resp. <a href=""https://www.last.fm/music/Majk+Spirit"">Read more on Last.fm</a>",10462,445890,"['Suvereno', 'Delik', 'H16', 'Paulie Garand', 'Rytmus']"
Ruelle,"Maggie Eckford (born c. 1986), better known by her stage name Ruelle, is an American electronic pop singer-songwriter. Her music is widely used on many television series, and she is the singer of the opening theme songs of Shadowhunters (""This Is the Hunt"") and The Shannara Chronicles (""Until We Go Down"").

Born the middle child of three sisters to a trucker in Mississippi, Ruelle was raised on a dairy farm. She attended music school in Sydney, Australia. <a href=""https://www.last.fm/music/Ruelle"">Read more on Last.fm</a>",419496,6980597,"['Fleurie', 'Madalen Duke', 'Raign', 'Natasha Blume', 'Valerie Broussard']"
AHI,"AHI is a Canadian singer-songwriter from Brampton, Ontario. <a href=""https://www.last.fm/music/AHI"">Read more on Last.fm</a>",61672,285616,"['Aisha Badru', 'Craig Cardiff', 'Foy Vance', 'Mipso', 'Harrison Storm']"
El Tri,"El Tri is Mexican Rock en Español band from Mexico City fronted by Alex Lora. The band was previously known as ""Three Souls in my Mind"" that dated back to the late 1960s. They play Rock and roll, acoustic rock, Blues-rock, and Blues. 

Among their greatest hits -after their Three Souls era- ""Triste Cancion"" (based on Neil Young's ""Like a Hurricane""), ""Metro Balderas"" (originally by Rodrigo Gonzalez), and ""Piedras Rodantes"" are probably the most known and have the quality of Anthems. <a href=""https://www.last.fm/music/El+Tri"">Read more on Last.fm</a>",132662,1533322,"['Tex Tex', 'Cuca', 'Jaguares', 'Maldita Vecindad Y Los Hijos Del Quinto Patio', 'La Lupita']"
Yes Sir Boss,"Yes Sir Boss have cultivated a truly original, distinct and indefinable sound that has elements of everything from a brooding Balkan blues band to a horn injected indie rock outfit…  In the end, though, it’s the ecstatic meeting of all their diverse sounds that makes YSB’s funky, rootsy, uplifting tunes so beguilingly unique. Their heavy blend of horn led hooks, offbeat rhythms and epic riffs provide the perfect backing for the memorable and <a href=""https://www.last.fm/music/Yes+Sir+Boss"">Read more on Last.fm</a>",6738,70648,"['BabyHead', 'Scubaroots', 'By the Rivers', 'New Town Kings', 'Dizraeli and the Small Gods']"
Chavar Dontae,"Chavar Dontae is an artist that emits an attitude and a lifestyle. A true artist  from Midwest whose juxtaposition of soul rock and indie electronic music is conscious of real life struggles. In his songs, the singer-songwriter approaches emotional turmoil with attitude but is nevertheless optimistic at the end of the day. Chavar grew up in Saginaw, MI and Toledo, OH and was formally educated in Guitar Performance at Bowling Green State University where he attended master classes with legendary musicians including Yo Yo Ma and Ray Brown. <a href=""https://www.last.fm/music/Chavar+Dontae"">Read more on Last.fm</a>",382,4052,"['Eloise Viola', 'Lord Veejay', 'Obee-1', 'Puneet Gabriel McCorrison', 'Sreejit Poole']"
Mo-Dettes,"The all-female Mo-dettes were formed in early 1979, originally calling themselves The Bomberettes. And although the assumption is that they were a mod band, this is incorrect: some called them punk, others thought they were more pop-punk, while still others compared their music to that of early Raincoats or Slits.

Guitarist Kate Korus, who had previously played with the all-female bands the Castrators and also Slits, was originally from the States, although she'd lived in England since 1974. <a href=""https://www.last.fm/music/Mo-Dettes"">Read more on Last.fm</a>",48647,291323,"['The Monochrome Set', 'Liliput', 'Delta 5', 'Au Pairs', 'Essential Logic']"
Carlos Segarra," <a href=""https://www.last.fm/music/Carlos+Segarra"">Read more on Last.fm</a>",801,4379,"['Los Rebeldes', 'Gatos Locos', ""Rock 'N' Bordes"", 'Rey Lui', 'The Nu Niles']"
Lenny Kravitz,"Leonard Albert ""Lenny"" Kravitz (born May 26, 1964. New York, USA) is an American singer-songwriter, record producer, guitarist and actor whose retro amalgam of rock, pop, funk, and even techno is inspired by such music icons as David Bowie, Jimi Hendrix and John Lennon. Like Prince and Sly Stone before him, Kravitz uses a multi-ethnic, mixed-gender backing band.

Kravitz plays guitar, bass, drums, keyboards, percussion, and sitar. He often plays these instruments on each recorded track <a href=""https://www.last.fm/music/Lenny+Kravitz"">Read more on Last.fm</a>",2541326,42804505,"['Prince', 'Seal', 'Prince and the New Power Generation', 'Prince & The Revolution', ""Fun Lovin' Criminals""]"
Kidedo," <a href=""https://www.last.fm/music/Kidedo"">Read more on Last.fm</a>",1232,5994,"['James Corbin', 'Gargutti', 'Johnny Woods', 'George Georgia', 'Nicolas Dagnall']"
Monstaz.,"Monstaz. is an electronic-rock project from Budapest, Hungary made by Daniel Kovago.

Soundcloud: http://soundcloud.com/monstaz-1
YouTube: http://www.youtube.com/user/mnstz686
Facebook: http://www.facebook.com/monstazband <a href=""https://www.last.fm/music/Monstaz."">Read more on Last.fm</a>",14126,125093,"['Panda Eyes', 'Krewella', 'Unlike Pluto', 'Jim Yosef', 'Noisestorm']"
Darkcore," <a href=""https://www.last.fm/music/Darkcore"">Read more on Last.fm</a>",527,4282,"['Coffeecore', 'Travon', 'Creatures of the Occult', 'Deadface', 'Micron']"
Korn,"Korn (stylized as KoЯn, or occasionally KoRn) is an American nu metal band from Bakersfield, California, formed in 1993. The band is notable for pioneering the nu metal genre and bringing it into the mainstream. Originally formed in 1993 by three members of the band L.A.P.D., Korn's current lineup features founding members James ""Munky"" Shaffer (guitar); Reginald ""Fieldy"" Arvizu (bass); Brian ""Head"" Welch (guitar, backing vocals); and Jonathan Davis (lead vocals <a href=""https://www.last.fm/music/Korn"">Read more on Last.fm</a>",3685484,234933042,"['Slipknot', 'Limp Bizkit', 'Jonathan Davis', 'Coal Chamber', 'Mudvayne']"
Los Gofiones,"-------Agrupación de Música Popular Los Gofiones-------

       Los Gofiones nace el 3 de septiembre de 1968 cuando un grupo de jóvenes, amantes de las viejas tradiciones de su pueblo, se reúne con el afán de realizar labores de investigación y rescate en el campo del folclore canario.
 
        Un año más tarde el Teatro Pérez Galdós, en Las Palmas de Gran Canaria, sería el testigo de la primera actuación del conjunto, así como de la grabación del primero de sus discos. <a href=""https://www.last.fm/music/Los+Gofiones"">Read more on Last.fm</a>",3454,23298,"['Los Sabandeños', 'Taburiente', 'Mestisay', 'Benito Cabrera', 'El Consorcio']"
Julio Jaramillo,"Julio Alfredo Jaramillo Laurido, also known as J.J., (born October 1, 1935 in Guayaquil, Ecuador, died February 9, 1978) was one of the greatest ""Pasillo"" performers. He was well known throughout Latin American as well as Spain, performing and recording boleros, valses, pasillos, tangos, rancheras. <a href=""https://www.last.fm/music/Julio+Jaramillo"">Read more on Last.fm</a>",155250,2466958,"['Alci Acosta', 'Los Panchos', 'Los Dandys', 'Los Tres Reyes', 'Daniel Santos']"
Lou Cifer & The Hellions," <a href=""https://www.last.fm/music/+noredirect/Lou+Cifer+&+The+Hellions"">Read more on Last.fm</a>",220,1926,[]
Twitch the King of Clubs," <a href=""https://www.last.fm/music/Twitch+the+King+of+Clubs"">Read more on Last.fm</a>",2,2,[]
J. Rawls,"Known in the independent rap world for his production skills, J. Rawls has worked with everyone from Masta Ace, The Beastie Boys, Wordsworth, Black Star and J Sands (who he works with as one half of Ohio's underground hip-hop group Lone Catalysts). With his earliest recollection of hip-hop from movies such as ""Wild Style"" and ""Beat Street"" and influenced by Madlib, Pete Rock and Jay Dee he has always produced and made music he has loved. In 2001 he released his solo debut called ""The Essence of J. <a href=""https://www.last.fm/music/J.+Rawls"">Read more on Last.fm</a>",142359,1100910,"['Bugseed', 'Jazz Liberatorz', 'DJ Mitsu the Beats', 'Witness', '3582']"
Shockwave-Sound," <a href=""https://www.last.fm/music/Shockwave-Sound"">Read more on Last.fm</a>",13153,136534,"['Thundermother', 'Shakra', 'The Treatment', 'Сигнал', 'Those Damn Crows']"
Giles Palmer," <a href=""https://www.last.fm/music/Giles+Palmer"">Read more on Last.fm</a>",1089,4286,"['Alexx Calise', 'Debbie Neigher', 'MARCUS FRENCH', 'Tiffany Thompson', 'Photronique']"
Daughter,"Daughter is Elena Tonra, a singer/songwriter from North London, UK.

After releasing a 4 track Demo EP, Elena joined forces with Igor Haefeli to produce 'His Young Heart' in April 2011. On November 2011, with the addition of Remi Aguilella on drums, 'The Wild Youth - EP' was released via Communion Records.

The band signed in 2012 with 4AD and in August a new track, 'Smother', surface online. A 7"" single of the song was released on October 1st, including a new version of 'Run'. <a href=""https://www.last.fm/music/Daughter"">Read more on Last.fm</a>",1372517,50697660,"['Ex:Re', 'Lanterns on the Lake', 'Syd Matters', 'Angus & Julia Stone', 'Billie Marten']"
Amistades Peligrosas,"Amistades Peligrosas was a Spanish band formed in 1989 by singers Alberto Comesaña from Galicia and Cristina del Valle from Asturias. Their music blended two Spanish Music types such as Celtic and Arab which is part of Spanish history and culture. Bagpipes, flute and bouzouki are common instruments used by the band. Amistades Peligrosas disbanded in July 1998. <a href=""https://www.last.fm/music/Amistades+Peligrosas"">Read more on Last.fm</a>",54671,427805,"['OBK', 'Ella Baila Sola', 'Ana Torroja', 'Amaral', 'The Sacados']"
Warrior Rapper School," <a href=""https://www.last.fm/music/Warrior+Rapper+School"">Read more on Last.fm</a>",1799,28939,"['Norick', 'Dj Deportado', 'Rapper School', 'Hip Hop Peruano Mas Na', 'Santa Suerte']"
Mariachi Ordaz," <a href=""https://www.last.fm/music/Mariachi+Ordaz"">Read more on Last.fm</a>",470,1309,"['Mariachi Juvenil Tecalitlan', 'Mariachi Nuevo Tecatitlan De Fernando Martinez', 'Mariachi Los Arrieros del Valle', 'Roberto Cantoral', 'MARIACHI IMPERIAL VILLA HIDALGO']"
PPS The Ghost Writah," <a href=""https://www.last.fm/music/PPS+The+Ghost+Writah"">Read more on Last.fm</a>",5,19,[]
Lucero,"There is more than one artist with this name.
1) an American alt-country band based in Memphis, Tennessee
2) a Mexican singer and actress

1)     Lucero is an American country-punk rock band that is based in Memphis, Tennessee. Their punk rock roots flavour their now ""country-ish"" music, while their Southern roots give them the twang that they have come to be known by. The band played for the first time in early 1998. Since 2001, they have played between 150 and 200 shows a year across the United States and Canada. <a href=""https://www.last.fm/music/Lucero"">Read more on Last.fm</a>",199312,7438463,"['Drive-By Truckers', 'Ben Nichols', 'Slobberbone', 'Cory Branan', 'American Aquarium']"
509-E,"509-E é um grupo de rappers de São Paulo, que apos serem presos começaram a fazer poesias e encontraram o sucesso na musica, o nome do grupo 509-E é devido ao nome do pavilhão que eles vivem no presidio. <a href=""https://www.last.fm/music/509-E"">Read more on Last.fm</a>",64809,690947,"['Sabotage', 'Trilha Sonora do Gueto', 'RZO', 'Ndee Naldinho', 'Realidade Cruel']"
Ze Esatek!," <a href=""https://www.last.fm/music/Ze+Esatek%21"">Read more on Last.fm</a>",1463,19904,"['Esne Beltza', 'Hesian', 'skakeitan', 'Egurra ta Kitto', 'En Tol Sarmiento']"
Smoking U," <a href=""https://www.last.fm/music/Smoking+U"">Read more on Last.fm</a>",4780,16060,"['Tamara Perez', 'Elena Monis', 'Catenaria', 'Danny Brian', 'Sandra Molinas']"
Demo D Brusko," <a href=""https://www.last.fm/music/Demo+D+Brusko"">Read more on Last.fm</a>",16,22,[]
Heather Renee,"The song Drifting from Heather Renee was specially adapted for use in the score to the critically acclaimed independent film, ""Four Eyed Monsters.""

Heather Renee is a singer/songwriter known for her beautiful melodies and insightful lyrics about love & life. She describes her music as Indie Folk Pop and has been compared to artists like Feist, Regina Spektor, and Priscilla Ahn. Her blog, indiefolkpop.com, links fans to other artists in her genre.  <a href=""https://www.last.fm/music/Heather+Renee"">Read more on Last.fm</a>",559,3204,"['Jazz Callner', 'Paper Jones', 'The Golden Pastime', 'Magdyn Osh', 'Joel Kennedy']"
Andre Fisichella," <a href=""https://www.last.fm/music/Andre+Fisichella"">Read more on Last.fm</a>",158,1807,"['Grégory Toucas', 'Anacole Daalderop', 'Gildas Martin', 'David Kpossou', 'Bridgetown Sextet']"
AB Soto,"AB Soto is a queer musician and musician whose function complicates the limitations of fashion, functionality and identification. Having developed being a Latin guy in East LA, Soto’s music is normally heavily up to date by both his ties to Mexican lifestyle and his history in dance and style design. He issues macho perceptions of Latinx lifestyle with his mixture of womanly signifiers and Mexican lifesty.
La música es uno de los motores más poderosos de la creación humana <a href=""https://www.last.fm/music/AB+Soto"">Read more on Last.fm</a>",2887,25989,"['Cazwell', 'Bebe Zahara Benet', 'Monique Heart', 'Naomi Smalls', 'Robbie Tronco']"
Sukima Switch,"Sukima Switch (スキマスイッチ?) is a Japanese jazz fusion duo consisting of core members Takuya Ōhashi (大橋卓弥, Ōhashi Takuya?), born May 9, 1978, and Shintarō Tokita (常田真太郎, Tokita Shintarō?), born February 25, 1978, formed in 2003. Formerly part of BMG Japan (bought by SMEJ in early 2009), they are part of Sony Music Japan's Areola Japan label since September 2009.

Ōhashi's musical duties include vocals, guitar, and harmonica while Tokita's duties include piano/keyboard <a href=""https://www.last.fm/music/+noredirect/Sukima+Switch"">Read more on Last.fm</a>",112110,1261392,[]
Titti Bianchi," <a href=""https://www.last.fm/music/Titti+Bianchi"">Read more on Last.fm</a>",1614,5220,"['Pino Villa', 'Stefano Parnasso', 'Enrico Musiani', 'El Canfin', 'Gino Finocchiaro']"
Vicky Arlidge,"Vicky's performances as a musical comedian have reached over 70,000 YouTube hits. 

In 2013 her Edinburgh Fringe show was nominated for the Funny Women Best Show Award and she has twice performed at Glastonbury. Her comic animations have made the 'official selection' of the London Short Film Festival (2015 and 2016) and the St Albans Film Festival (2014 and 2015). She has been composing music for TV and theatre for over 25 years and has BAFTA and EMMY nominated credits to her name.  <a href=""https://www.last.fm/music/Vicky+Arlidge"">Read more on Last.fm</a>",41607,969888,"['Cocomelon', 'Nursery Rhymes 123', 'Pinkfong', 'Little Baby Bum Nursery Rhyme Friends', 'Raffi']"
Pereza,"Pereza is composed by the guitarrist Ruben (ex Buenas Noches Rose) and the bassist Leiva (ex Malahierba). In their concerts they play with another guitarrist called Pitu and a drummer called Rober.
They have released six albums: ""Pereza"", ""Algo para cantar"", ""Animales"", ""Los amigos de los animales"", ""Aproximaciones"" and ""Aviones"". <a href=""https://www.last.fm/music/Pereza"">Read more on Last.fm</a>",192205,4243425,"['El Canto del Loco', 'Leiva', 'Fito Y Fitipaldis', 'M-Clan', 'Estopa']"
Battleboi Basti,"BattleBoi Basti (15. April 1984 in Eberswalde-Finow; kurz „BBB“; auch bekannt als Ficksch; bürgerlich Stefan Schwensow) ist ein deutscher Rapper.

Erstmals 2008 erschien Schwensow unter dem Pseudonym Ficksch bei der Gruppe MOTek auf dem Album DreiMalDrei. Kurz darauf wollte sich die Gruppe ""lustige Gangster-Images"" schaffen und formierte sich als Click Clack Clique neu. Während dieser Umwandlung erschuf Ficksch zwei Alter Egos: BattleBoi Basti und Lil ILL. <a href=""https://www.last.fm/music/BattleBoi+Basti"">Read more on Last.fm</a>",10360,239360,"['Ésmaticx', 'donetasy', 'DirtyMaulwurf', 'Mikzn70', 'Maddust']"
