artista,biografia,oyentes,reproducciones,artistas_similares
Mario Diaz," <a href=""https://www.last.fm/music/Mario+Diaz"">Read more on Last.fm</a>",6045,43125,"['El Puchero del Hortelano', 'La Selva Sur', ""D'Callaos"", 'Los Barrankillos', 'Antílopez']"
Heddshotts," <a href=""https://www.last.fm/music/Heddshotts"">Read more on Last.fm</a>",94,2452,"['IDE', 'Block McCloud & DJ Waxwork', 'Words & Rhymes', 'Babylon Warchild', 'Blacastan']"
Doctor Flake,"Doctor Flake is a French producer and composer evolving in the Hip Hop/Abstract/Trip Hop styles like a kind of a musical surgeon, a medical expert of musical cutting.

His production started in 2001 by developing his own mainly instrumental musical universe based on already existing materials. These various extracts are then thoroughly and accurately dismembered and dissected before being reassembled and rearranged to create a new living track.

As a legitimate heir to the sampling madness <a href=""https://www.last.fm/music/Doctor+Flake"">Read more on Last.fm</a>",122509,1767326,"['Saltillo', 'Glen Porter', 'EZ3kiel', 'Degiheugi', 'Roger Molls']"
The Frank And Walters,"The Frank and Walters are a pop/rock band from Cork, Ireland.

Founded in 1990 the group (named in honour of two eccentric Cork characters) are Paul Linehan (vocalist/bassist), his brother Niall Linehan (guitar) (replaced by Kevin Pedreschi in 2004) and Ashley Keating (drums).

Signing to the Setanta label in 1991, the group debuted with album EP1, and the lead track ""Fashion Crisis Hits New York"" became an indie hit. The follow-up album EP.2 was quickly forthcoming. <a href=""https://www.last.fm/music/The+Frank+and+Walters"">Read more on Last.fm</a>",43639,414771,"['A House', 'Cinerama', 'The Wedding Present', 'Cud', 'Sultans Of Ping F.C.']"
ERock,"Erock is the stage name for Shred Guitarist Eric Calderone. 

Listen/ Download all covers http://shredguitareric.com/listen

Hailing from Tampa, FL, Calderone began playing the guitar seriously in 2001. He studied classical guitar at the University of Tampa, in Tampa, Florida, and orchestration for film and TV at Berklee College of Music.

Also known as 331Erock on youtube, Calderone has been racking up views across the world with shred metal covers of tv and movie themes, as well as popular music. <a href=""https://www.last.fm/music/Erock"">Read more on Last.fm</a>",51916,764953,"['Daniel Tidwell', 'FamilyJules7x', 'Jonathan Young', 'RichaadEB', 'Charlie Parra Del Riego']"
DJ Gollum,"Real Name: Lars Böge
Profile: In the year 1993 (already in a technoinfected stadium) DJ Gollum met DJ Hunter at a small village-club. After a lot of some delicious Southern/Ginger they decided to buy two turntables and a mixer. They started to play at some privatparties.. well, thats the typical way, I guess. 1994 was the year of Gollum's first bookings. His first gig was at the ""Secret"" in Wedel (nowadays called Maxx Musichall). In the same year <a href=""https://www.last.fm/music/DJ+Gollum"">Read more on Last.fm</a>",187439,2185476,"['Empyre One', 'Marc Korn', 'Manian', 'DJ Satomi', 'Italobrothers']"
Rei da Cacimbinha," <a href=""https://www.last.fm/music/Rei+da+Cacimbinha"">Read more on Last.fm</a>",30732,164927,"['Biu do Piseiro', 'Jerry Smith', 'Thullio Milionário', 'DJ Marlboro', 'Raquel dos Teclados']"
Walter Meego,"Walter Meego is a band that was formed in 2004 in Chicago.  The band was formed by Justin Sconza (guitar, keyboards and vocals) and Colin Yarck (production).  In 2007, Andrew Adzemovic (guitar and vocals) joined.  In 2010, Simon Smith joined on bass, Duncan Thum on keyboards and Tyler Sabbag on drums.

They released a series of EP's before their debut album, ""Voyager"", which came out in May of 2008.  Their sophomore album is called ""Wondervalley"" and was released November 24th on the official Walter Meego website as well as iTunes. <a href=""https://www.last.fm/music/Walter+Meego"">Read more on Last.fm</a>",94312,931101,"[""Natalie Portman's Shaved Head"", 'Muscles', 'Pacific!', 'Gameboy/Gamegirl', 'The Twelves']"
HipHop Egypt," <a href=""https://www.last.fm/music/HipHop+Egypt"">Read more on Last.fm</a>",1,1,[]
Mircea Baniciu,"Mircea Baniciu s-a nascut la Timisoara la data de 31 iulie 1949, intr-o duminica cu soare. A urmat o copilarie fericita in cartierul elisabetic de langa complexul studentesc timisoarean, lucru care avea sa-l influenteze tot restul vietii. S-a apucat de scoala la 7 ani, si n-as putea spune ca i-a prea placut. Un tip perseverent totusi, a reusit sa termine primele 7 clase, apoi la indemnul mamei sale care-i promisese o chitara daca intra la liceu, a facut-o! Cu mari eforturi <a href=""https://www.last.fm/music/Mircea+Baniciu"">Read more on Last.fm</a>",4785,74673,"['Mircea Vintila', 'Nicu Alifantis', 'Ducu Bertzi', 'Pasarea Colibri', 'Vasile Seicaru']"
Cymarshall Law,"Cymarshall Law is a MC's MC.
Currently an has an album out called 'Hip Hop In the Flesh' and another Freedom with brother Skit Slam in their group Everliven Sound , both albums are currently on sale in may place online including itunes. He has recently collabed with KRS-ONE for the single CONTROL that is the first single that will lead to the full album by Cymarshall Law & producer Mr. Joeker out of Hungary the album is a follow up to Hip Hop in the Flesh and called 'Hip Hop in the Soul' scheduled for 2008 Summer release. Full Bio Below <a href=""https://www.last.fm/music/Cymarshall+Law"">Read more on Last.fm</a>",2987,37655,"['Cymarshall Law & Mr. Joeker', 'Everliven Sound', 'Silent Knight', 'Cymarshall Law & The Beatnikz', 'Sha Stimuli']"
Hues Corporation,"The Hues Corporation was a pop and soul trio of the 70s, best known for their 1974 infectious hit ""Rock The Boat"". The song, a U.S. #1 single and million-seller that's still a radio staple, is considered one of the earliest disco songs. Some authorities proclaim it to be the first disco song to hit #1, while others grant that distinction to ""Love's Theme"" by the Love Unlimited Orchestra, a chart-topper from earlier in 1974. The Hues Corporation has played on into the new millennium, although facing many challenges. <a href=""https://www.last.fm/music/Hues+Corporation"">Read more on Last.fm</a>",163372,679706,"['Tavares', 'The Real Thing', 'Chic', 'The Trammps', 'KC and The Sunshine Band']"
Fakoli," <a href=""https://www.last.fm/music/Fakoli"">Read more on Last.fm</a>",18,36,[]
Savia Andina,"Savia Andina was one of the first groups to have international success with traditional Andean music. They had this success starting in the 1960s and went on to have three albums to go gold. Eddy Navia, a founder of the group noted as a charango player, left in 1978 to join Sukay. <a href=""https://www.last.fm/music/Savia+Andina"">Read more on Last.fm</a>",12101,153478,"['Proyección', 'Horizontes', 'Kala Marka', 'Maya Andina', ""Jach'a Mallku""]"
HipHop Liechtenstein," <a href=""https://www.last.fm/music/HipHop+Liechtenstein"">Read more on Last.fm</a>",4,19,"['eh luagen uf eu', 'Al Walser', 'Rääs', 'Heria', 'Landvogt']"
Lee Andre," <a href=""https://www.last.fm/music/Lee+Andre"">Read more on Last.fm</a>",5955,21260,"['Danny Brian', 'Tamara Perez', 'Rod Mckinley', 'Jessie Hock', 'Smoking U']"
Jauz,"Sam Vogel, better known by his stage name Jauz (/dʒɔːz/ JAW-z),is an American DJ and electronic dance music producer based in Los Angeles, United States.
Vogel grew up in Northern California. He began playing guitar and producing electronic music on his computer at the age of 15. He went to Icon Collective music production school. He previously went to a film school in Loyola Marymount University before deciding to pursue a musical career, prompting him to enroll in Icon Collective. <a href=""https://www.last.fm/music/Jauz"">Read more on Last.fm</a>",217818,2400538,"['RL Grime', 'AC Slater', 'NGHTMRE', 'Tchami', 'Dombresky']"
DJ Stan Nation," <a href=""https://www.last.fm/music/DJ+Stan+Nation"">Read more on Last.fm</a>",135,349,"['DJ Cvince', 'Top 40 radio', 'Remix Hits', 'All Star Hits', 'Radio Dj']"
Lil Scrappy,"Lil Scrappy (born January 20, 1984) is the stage name of rapper Darryl Richards II. He was discovered by producer Lil Jon while performing at a school concert in his hometown of Atlanta. Along with labelmates Trillville, Lil Scrappy was one of the first signings to Lil Jon's BME Recordings.

Lil Scrappy built a strong reputation and eager following throughout the southeast through mixtapes and the street anthem of 2003 ""Head Bussa."" During this time, Lil Jon inked a deal to bring his BME Recordings to Warner Bros. <a href=""https://www.last.fm/music/Lil+Scrappy"">Read more on Last.fm</a>",137061,803398,"['Trillville', 'YoungBloodz', 'Dem Franchize Boyz', 'Lil Jon & The East Side Boyz', 'Pastor Troy']"
César Pop," <a href=""https://www.last.fm/music/C%C3%A9sar+Pop"">Read more on Last.fm</a>",526,6854,"['Los Madison', 'Rubén Pozo', 'Alfredo González', 'Quique González', 'José Ignacio Lapido']"
Francesco Zeta,"Francesco Zeta is an Italian DJ & producer. He was born in 1981 in Torino. His first real DJ experience came in 1999, when he started to work in a local club in the north west of Italy, playing techno & trance.

In 2001 he also started playing hardstyle. His work didn't go unnoticed and thanks to DJ Activator, in 2007 he started to collaborate with EDINET Publishing Group / KATTIVA records as a hardstyle DJ, producer and remixer.

The year 2008 has been an important year for Francesco <a href=""https://www.last.fm/music/Francesco+Zeta"">Read more on Last.fm</a>",29832,245667,"['Blutonium Boy', 'Technoboy', 'Zatox', 'DJ Isaac', 'Da Tweekaz']"
DJ Eezy," <a href=""https://www.last.fm/music/DJ+Eezy"">Read more on Last.fm</a>",7660,39234,"['i-genius', 'Dj Boomin', 'Can You Flow?', 'Liquid Audio', 'B Lou']"
Stuart Roslyn," <a href=""https://www.last.fm/music/Stuart+Roslyn"">Read more on Last.fm</a>",5910,29399,"['Generdyn', 'Sunseekers', 'DeepCosmo', 'eenspire', 'Yehezkel Raz']"
The Poppees," <a href=""https://www.last.fm/music/The+Poppees"">Read more on Last.fm</a>",1869,12496,"[""The 'B' Girls"", 'Blue Ash', 'Paley Brothers', 'The Shivvers', 'The Spongetones']"
Absolute Music,"Absolute Music is a scandinavian compilation series of chart hits(with different tracklistings for each country), which has run from late 80's until present day. During rips, the artist name has been written as Absolute Music, and therefore this profile has been created most likely, therefore keep in mind that it's actually not a band or an artist itself.
The genres of each CD has ranged from techno to rock, depending on what has been popular at the time each CD was compiled. <a href=""https://www.last.fm/music/Absolute+music"">Read more on Last.fm</a>",2307,32020,"['Blandat', 'Vestlandsfanden', 'Morten Abel', 'Luxus Leverpostei', 'Brolle Jr']"
"DJ Tomekk feat. GZA, Prodigal Sunn, Curse & Stieber Twins"," <a href=""https://www.last.fm/music/DJ+Tomekk+feat.+Gza,+Prodigal+Sunn,+Curse+&+Stieber+Twins"">Read more on Last.fm</a>",1794,6108,"['DJ Tomekk feat. KRS One, MC Rene & Tony Torch', 'DJ Tomekk feat. Grandmaster Flash, Afrob, Flavour Flav & MC Rene', 'DJ Tomekk feat. Kurupt, Tatwaffe, G-Style', 'DJ Tomekk feat. Lil Kim & Trooper Da Don', 'DJ Thomilla']"
David Linx,"David Linx (born 22 March 1965 in Brussels) is a Belgian jazz and chanson singer, composer and lyricist.

Linx, a son of the composer and musician Elias Gistelinck, studied percussion and was the drummer of the American jazz singer Mark Murphy for three years, which motivated him to start singing himself. Linx has been teaching jazz singing at the Royal Conservatory in Brussels since 1993. In 1986 he recorded a record with a large group of musicians with the American writer and activist James Baldwin, who reads poems on it. <a href=""https://www.last.fm/music/David+Linx"">Read more on Last.fm</a>",5886,26101,"['Eric Legnini & The Afro Jazz Beat', 'Fay Claassen', 'Anthony Strong', 'Paul Lay', 'Stéphane Belmondo']"
María Jesús y su acordeón," <a href=""https://www.last.fm/music/+noredirect/Mar%C3%ADa+Jes%C3%BAs+y+su+acorde%C3%B3n"">Read more on Last.fm</a>",1088,2900,"['Accordion Festival', 'Georgie Dann', 'Acordeón Latino', 'Jorge Sepúlveda', 'Los 3 sudamericanos']"
Markpain," <a href=""https://www.last.fm/music/Markpain"">Read more on Last.fm</a>",71,126,"['Yung-Trav', 'P Stakz', 'YuroLafam', 'Trigga Racci', 'Dreemy Sinatra']"
Goldfrapp,"Goldfrapp is an English electronic band from London, formed in 1999 which consists of Alison Goldfrapp (vocals, synthesizer) and Will Gregory (synthesizer). Despite favourable reviews and a short-listing for the Mercury Prize, the début studio album Felt Mountain did not chart highly. Goldfrapp's second album Black Cherry, which incorporated glam rock and synthpop sounds, was released in 2003. The album influenced the same dance-oriented sound of their third album Supernature. <a href=""https://www.last.fm/music/Goldfrapp"">Read more on Last.fm</a>",1913894,54208918,"['The Funky Lowlives', 'Marsmobil', 'Soma Sonic', 'Berry Weight', 'The Karminsky Experience Inc.']"
Neckbreakerz," <a href=""https://www.last.fm/music/Neckbreakerz"">Read more on Last.fm</a>",88,1600,"['Gavlyn', 'DJ Brans', 'Vel the Wonder', 'Twin Perils', 'Taiyamo Denku']"
MIKA,"There are multiple bands/artists under the name Mika.

1) Mika (born Michael Holbrook Penniman in 1983) is a Lebanese-born British singer. He first appeared on BBC Radio 1 in September 2006. He has a background in classical songwriting. 

His long awaited first album Life In Cartoon Motion was commercially released on 5th February 2007. It has a coming of age theme, and deals with the transition from childhood to his current position in life. His debut single was Relax <a href=""https://www.last.fm/music/Mika"">Read more on Last.fm</a>",2322122,55969103,"['Scissor Sisters', 'Take That', 'Robbie Williams', 'Olly Murs', 'James Blunt']"
Hollywood Trailer Music Orchestra," <a href=""https://www.last.fm/music/Hollywood+Trailer+Music+Orchestra"">Read more on Last.fm</a>",16605,96941,"['Lolita Ritmanis', 'Paul Misraki', 'Veigar Margeirsson', 'Paul Gorman', 'Scorched Score Music']"
Miguel De Los Reyes," <a href=""https://www.last.fm/music/Miguel+de+Los+Reyes"">Read more on Last.fm</a>",730,3277,"['Miguel Poveda', 'El Pele', 'Canalejas de Puerto Real', 'Kiki Morente', 'Vicente Soto Sordera']"
Pixies,"Pixies is an American alternative rock band which formed in Boston, Massachusetts, United States in 1986. The band consists of Charles (Black Francis) Thompson IV (vocals, guitar; also known as ''Frank Black''), Joey Santiago (lead guitar),   David Lovering (drums) and Emma Richardson (bass, vocals). Until 2013, the band also featured  Kim Deal on bass and vocals. From 2016 until 2024 the band also featured Paz Lechantin on bass and vocals.   The band officially split in 1993  and reunited in 2004. <a href=""https://www.last.fm/music/Pixies"">Read more on Last.fm</a>",3845366,185141479,"['Frank Black', 'The Breeders', 'Sonic Youth', 'Frank Black and the Catholics', 'Violent Femmes']"
Nightstalker,"1) The Greek stoner fathers. Formed in Athens, Greece in the early 90's, Nightstalker are considered as a 'cult' band of the stoner rock scene. Well known for their notorious live performances.
Over the past years NIGHTSTALKER have earned a reputation due to their pure Rock ‘n Roll attitude and their constant live activity, and been lauded with the highest praise and respect since their beginnings in 1990.
The whole concept was realized by the singer (and drummer at that time), Argy, who was the founder member of the band. <a href=""https://www.last.fm/music/Nightstalker"">Read more on Last.fm</a>",40514,636304,"['Planet of Zeus', '1000mods', 'Valley of the Sun', 'Black Rainbows', 'Greenleaf']"
Joe Bonamassa,"Joe Bonamassa (born May 8, 1977) is an American blues rock  guitarist, singer and songwriter.

Bonamassa was born in Utica, New York. He started playing guitar at age four, encouraged by his father, who was an avid music fan and exposed him to British blues rock records by Eric Clapton and Jeff Beck, greatly inspiring him. At 11 years old Joe was mentored and trained by American guitar legend, Danny Gatton. When he was 12 years old, he had his own band called Smokin' Joe Bonamassa <a href=""https://www.last.fm/music/Joe+Bonamassa"">Read more on Last.fm</a>",449115,12601216,"['Kenny Wayne Shepherd Band', 'Beth Hart & Joe Bonamassa', 'Joanne Shaw Taylor', 'Walter Trout', 'Black Country Communion']"
DJ Far," <a href=""https://www.last.fm/music/Dj+Far"">Read more on Last.fm</a>",84,770,"['Southside Playaz', 'D.E.A. Dead End Alliance', 'Botany Boyz', 'Lil’ Keke', 'H.S.E.']"
William Henries," <a href=""https://www.last.fm/music/William+Henries"">Read more on Last.fm</a>",552,2151,"['Disposable Youth', 'MARCUS FRENCH', 'Sonic Damasque', 'Guru Groove Fondation', ""Andrew Britton, Jesse O'Mahoney""]"
HipHop Guinea," <a href=""https://www.last.fm/music/HipHop+Guinea"">Read more on Last.fm</a>",1,1,[]
Ost,"OST is the name of several artists.

1) a Basque metal band
2) an experimental/math/atmospheric musician based in Ireland, OST - Original Soundtrack
3) a variation on Old School Tie
4) a variation on O.S.T.
5) a variation on Robbie Ost
6) a variation on Oswald Berthold
7) an alias of Petter Haavik

It may also be an incorrect artist tag for a soundtrack, if so do yourself and Last.fm a favour and fix your tags.


1) The history of this metal band from the Basque Country starts back on the summer of 1995 <a href=""https://www.last.fm/music/OST"">Read more on Last.fm</a>",190980,4185312,[]
Seu Jorge,"Jorge Mário da Silva, known by his stage name Seu Jorge, is a Brazilian musical artist, songwriter and actor. He is considered by many a renewer of Brazilian pop samba. Seu Jorge cites samba schools and soul singer Stevie Wonder as major musical influences. Jorge is also known for his film roles as Mané Galinha in the 2002 film City of God and as Pelé dos Santos in the 2004 film The Life Aquatic with Steve Zissou. His musical work has received praise from many of his fellow musicians including Beck and David Bowie. <a href=""https://www.last.fm/music/Seu+Jorge"">Read more on Last.fm</a>",842085,16889342,"['Ana Carolina & Seu Jorge', 'Arlindo Cruz', 'Os Originais Do Samba', ""Mart'nália"", 'Jorge Ben']"
Gary's Tyler," <a href=""https://www.last.fm/music/Gary%27s+Tyler"">Read more on Last.fm</a>",2684,7726,"['Deborah Goncalves', 'Walter Coppola', 'Be Like Mike', 'Elise Howard', 'Jubel Sax']"
The Playtones,"The Playtones is a Swedish rockabilly band which entered Melodifestivalen 2011 with the song ""The King"". <a href=""https://www.last.fm/music/The+Playtones"">Read more on Last.fm</a>",14079,121621,"['Tupelo Highshots', ""Elisa's"", 'The Fastback', 'Rolandz', 'TT Grace']"
Parranda El Golpito," <a href=""https://www.last.fm/music/Parranda+El+Golpito"">Read more on Last.fm</a>",12,35,[]
Grupo Cimarron De Cuba," <a href=""https://www.last.fm/music/Grupo+Cimarron+de+Cuba"">Read more on Last.fm</a>",11850,42548,"['Armando Garzón', 'Pedro Luis Ferrer', 'Asere', 'Orlando ""Cachaíto"" López', 'Mayito Rivera']"
The Abbasi Brothers,"Abbasi Brothers is an experimental music group based in Manhattan, New York City, signed to the independent label Dynamophone Records. The group consists of Yousuf Abbasi and Amman Abbasi.

Abbasi Brothers' debut album, Something Like Nostalgia, was released in July 2008, on Dynamophone Records worldwide. The album received positive reviews, with Headphone Commute in the US placing it on the Best Albums of 2008 list.[1]

In 2009, The Abbasi Brothers scored The Renaud Brothers' documentary, Warrior Champions. <a href=""https://www.last.fm/music/The+Abbasi+Brothers"">Read more on Last.fm</a>",77273,516899,"['Jatun', 'Winterlight', 'French Teen Idol', 'Amman/Josh', 'Absent Without Leave']"
Ray Smith,"Ray Smith, born October 30, 1934, died November 29, 1979 (suicide) birthplace Melber, Kentucky. Raised in Paducah, Kentucky, Ray Smith was taught piano at an early age and performed cowboy songs in school. As a teen he was a moonshine bootlegger with his brother-in-law and also worked for Coca-Cola. After a stint in the Air Force, Ray decided to jump on the burgeoning new rock and roll bandwagon, even though he admitted later that at first he hated rock and roll and his main influence was not Elvis, but Faron Young. <a href=""https://www.last.fm/music/Ray+Smith"">Read more on Last.fm</a>",76658,325443,"['Warren Smith', 'Guy Mitchell', 'Johnny Bond', 'Dion DiMucci', 'Eddie Cochran']"
Kirk Hellie," <a href=""https://www.last.fm/music/Kirk+Hellie"">Read more on Last.fm</a>",336,1221,"['Skinny Beanz', 'Benjamin Rew', 'Derek Lewars', 'Kerim Gunes', 'Age of Menace']"
Bob Mitchell," <a href=""https://www.last.fm/music/Bob+Mitchell"">Read more on Last.fm</a>",2680,12998,"['Irving Washington', 'The Uninspiration Chillout Gods', 'Dan Popplewell', 'Steve Buick', 'Dan Graham']"
Dash of Honey," <a href=""https://www.last.fm/music/Dash+of+Honey"">Read more on Last.fm</a>",5169,13932,"['The Cheer Squad', 'DJ Redbi', 'Luscious Lady', 'Bella Heart', 'Round2Crew']"
El Simbolo,"El Simbolo is an Argentinan dance/latin pop band formed by Frank Madero, Ramón Garriga, Tote Puerta, Nazarena Falero and Lorena Taibo. <a href=""https://www.last.fm/music/El+Simbolo"">Read more on Last.fm</a>",40553,187041,"['Fulanito', 'Elvis Crespo', 'Bacilos', 'Chichi Peralta', 'Carlos Vives']"
Westcoast Stone," <a href=""https://www.last.fm/music/Westcoast+Stone"">Read more on Last.fm</a>",1110,6043,"['Ivan Makvel', 'UnderMo', 'BEATSLAYA', 'MadD3E', 'Temu']"
Daniel Knight," <a href=""https://www.last.fm/music/Daniel+Knight"">Read more on Last.fm</a>",2780,10341,"['THE HEADCHOPPERZ', 'Stephen Green', 'Mark Tillman', 'Andrew Willingale', 'Tom Vedvik']"
The Blue Orchids,"1.
The Blue Orchids were formed in 1979 in Manchester, England by Martin Bramah and Una Baines, both formerly of The Fall. They were joined by Rick Goldstraw, guitar, Steve Toyne on bass and Joe Kin on drums. With this line up, they recorded the singles ""The Flood"" and ""Work"" for rough trade records.
The group underwent a series of personnel changes before the release of their album ""The Greatest Hit (Money Mountain"" (1981), which faetured Bramah, Baines (keyboards), Goldstraw (now on bass) and Toby Toman on drums. <a href=""https://www.last.fm/music/+noredirect/The+Blue+Orchids"">Read more on Last.fm</a>",1259,3531,[]
BOBBY,"There is more than one artist with the name Bobby.

1. BOBBY (hangul: 바비) (born Kim Ji-won; December 21, 1995 in Seoul, South Korea), is a South Korean rapper and member of the boy group iKON, currently signed under 143 Entertainment.

In 2014, he was the winner of the third season of the Mnet rap competition Show Me the Money. Alongside MINO, he is part of the hip hop duo MOBB, who released the four-track album The Mobb in September 2016.


2. <a href=""https://www.last.fm/music/Bobby"">Read more on Last.fm</a>",157380,3297656,"['B.I', 'Mino', 'HUH', 'Jay', 'ZICO']"
Ali Aka Mind,"Rapero Colombiano actualmente radicado en Buenos Aires Argentina, cuenta con una larga trayectoria en la cual ha plasmado su propia realidad y ha dejado en cada uno de sus tracks un mensaje de conciencia social basado en la realidad que tenemos que afrontar los pueblos de América latina hoy en día.

Ha llevado siempre como firme propósito dejar un legado para un cambio mental positivo y en pro de la libertad de expresión aportando desde su posición un granito de arena para la cultura del hip hop. <a href=""https://www.last.fm/music/ALI+aka+MIND"">Read more on Last.fm</a>",11066,157671,"['Frank Takuma', 'Cejaz Negraz', 'No Rules Clan', 'El Arkeologo', 'realidad mental']"
Rockstar,"There are several artist named RockStar or Rockstar:

1. Rockstar is a cover band featuring Tim ""Ripper"" Owens (Judas Priest, Iced Earth), Keri Kelli (Alice Cooper, Slash's Snakepit), James Kottak (Scorpions), Rudy Sarzo (Whitesnake, Ozzy Osbourne, Dio) and Teddy ""Zig Zag"" Andreadis (Guns N' Roses) - Projerct was renamed to Project Rock.
2. A Hard Rock/Sleaze band from Italy.
3. A group from the Philippines.
4. Jony Rockstar
5. An alias for Martin Sponnich. <a href=""https://www.last.fm/music/Rockstar"">Read more on Last.fm</a>",29920,232208,"['Rivermaya', 'Hale', 'Kamikazee', 'Cueshé', 'Sugarfree']"
Wild Party,"Formed in 2009, Wild Party is a power pop band from San Antonio, Texas. It is comprised of Lincoln Kreifels, Lucas Hughes, Ethan Kaufmann, and Cary LaScala. They have released one full length album, Phantom Pop, which was re-released in October 2014. Following a string of singles dating as far back as 2019, the band released an EP Get Up in 2023. Their second LP is slated for a 2023 release. <a href=""https://www.last.fm/music/Wild+Party"">Read more on Last.fm</a>",219591,3462688,"['CRUISR', 'The Happy Fits', 'Bad Suns', 'Kevin Walkman', 'HUNNY']"
The Rockabilly Rebels," <a href=""https://www.last.fm/music/The+Rockabilly+Rebels"">Read more on Last.fm</a>",2708,21857,"['The Fastback', 'Simon Crashly & The Roadmasters', 'Hank Sundown & The Roaring Cascades', 'Johnny & The Jailbirds', 'The Jetaways']"
2Pac,"Tupac Amaru Shakur (born Lesane Parish Crooks, June 16, 1971 – September 13, 1996), better known by his stage name 2Pac and later by his alias Makaveli, was an American rapper and actor. Considered one of the most influential rappers of all time, Shakur is among the best-selling music artists, having sold more than 75 million records worldwide. Much of Shakur's music has been noted for addressing contemporary social issues that plagued inner cities, and he is considered a symbol of activism against inequality. <a href=""https://www.last.fm/music/2Pac"">Read more on Last.fm</a>",3720428,120363745,"['Thug Life', 'The Notorious B.I.G.', 'Dr. Dre', 'Snoop Dogg', '50 Cent']"
