artista,biografia,oyentes,reproducciones,artistas_similares
The Prefects,"The Prefects were a punk band from Birmingham. In 1976 singer Robert Lloyd, with guitarist/drummer brothers Alan and Paul Apperley formed after an advert was placed in the Birmingham Evening Mail. They were Birmingham's first punk group. The band were part of The Clash's 'White Riot Tour', toured with Subway Sect, Buzzcocks, played with The Slits, The Jam, The Fall, The Damned, The Skids and many others, before recording two sessions for the John Peel radio show. <a href=""https://www.last.fm/music/The+Prefects"">Read more on Last.fm</a>",8419,37970,"['Disco Zombies', 'Nightingales', 'The Wasps', 'The Cravats', 'Johnny Moped']"
The Jetaways," <a href=""https://www.last.fm/music/The+Jetaways"">Read more on Last.fm</a>",2373,9566,"['Pepita Slappers', 'Mr. Breathless', 'Emmy Lou and the rhythm boys', 'Cherry Tess & Her Rhythm Sparks', 'Tupelo Highshots']"
Def Leppard,"Def Leppard is an English rock band formed in 1976 in Sheffield. Since 1992, the band has consisted of Rick Savage (bass, backing vocals), Joe Elliott (lead vocals), Rick Allen (drums, backing vocals), Phil Collen (guitar, backing vocals), and Vivian Campbell (guitar, backing vocals). They established themselves as part of the new wave of British heavy metal movement of the early 1980s.

The band's greatest commercial success came between the early 1980s and the early 1990s. <a href=""https://www.last.fm/music/Def+Leppard"">Read more on Last.fm</a>",1617976,36323408,"['Poison', 'Ratt', 'Dokken', 'Van Halen', 'Whitesnake']"
Korpus,"Korpus is a death/thrash metal band from Dresden, Germany formed in 2008.

http://www.korpus-metal.de <a href=""https://www.last.fm/music/Korpus"">Read more on Last.fm</a>",1439,9433,"['Azzaron', 'Super Box', 'Grzegorz Kupczyk', 'Open Fire', 'Lord Vader']"
Pink Turds In Space,"Pink Turds in Space was a hardcore punk band from Belfast, Ireland and was very much involved in the Warzone collective (Giros). <a href=""https://www.last.fm/music/Pink+Turds+In+Space"">Read more on Last.fm</a>",1256,18492,"['Sedition', 'Bleeding Rectum', 'Disaffect', 'G-ANX', 'Citizens Arrest']"
The Indie Alternative," <a href=""https://www.last.fm/music/The+Indie+Alternative"">Read more on Last.fm</a>",43,251,[]
Lluvia Con Sol," <a href=""https://www.last.fm/music/Lluvia+Con+Sol"">Read more on Last.fm</a>",455,1564,"['Merceron y Acerina', 'Orquesta de Mexico de Pedro Mendoza', 'Carlos Campos Y Orquesta', 'Danzonera Veracruz', 'Los Mejores Danzones']"
Bombilates," <a href=""https://www.last.fm/music/Bombilates"">Read more on Last.fm</a>",1990,3990,"['Jukebox Singers', 'Carnaby St Generation', 'HD Crew', 'B.T.O All Stars', 'The Hippies']"
Indie Band Weekend," <a href=""https://www.last.fm/music/Indie+Band+Weekend"">Read more on Last.fm</a>",333,569,"['Brian Marshall Band', 'Mega Party', 'Halloween Hit Squad', 'JJAHBG', ""Chief Secrets of a Bungling Empire Unexpectedly Hidden in General Patton's Tomahawk Museum""]"
James Mclean," <a href=""https://www.last.fm/music/James+McLean"">Read more on Last.fm</a>",2743,19207,"['Samuel Vendig', 'Cameo Adele', 'SIØBHAN', 'Sam Clines', 'The Nick Tree Band']"
Webstar,"Troy ""Webstar"" Ryan, a 19-year-old Harlem-based deejay and producer, is the creative force behind ""Chicken Noodle Soup,"" the great underground sensation of the summer of 2006.  He is also the co-executive producer of WEBSTAR PRESENTS…CAUGHT IN THE WEB (along with Arthur Smith and Kirk Burrowes), a compilation of new talent set for release on Universal Republic on September 26.  Finally, he is the owner, with his old friend and partner Arthur Smith, of a brand-new Fontana-distributed label called Scrilla Hill. <a href=""https://www.last.fm/music/Webstar"">Read more on Last.fm</a>",12967,47940,"['Ron Browz', 'Hot Stylz', 'DJ Webstar', 'Red Cafe', '2 Pistols']"
Christopher Zondaflex Tyler," <a href=""https://www.last.fm/music/Christopher+Zondaflex+Tyler"">Read more on Last.fm</a>",888,5615,"['Ballet Preschool Party', ""Kimbo Children's Music"", 'Kate Kuper and Neal Robinson', 'Nate Fifield', 'Trisha Wolf']"
Gregg Lehrman," <a href=""https://www.last.fm/music/Gregg+Lehrman"">Read more on Last.fm</a>",1298,9590,"['Laurent Lipszyc', 'Dom Kane', 'Peter Habib & Adam Nierow', 'Chris White, Guy Hatfield', 'David Travis Edwards']"
Ringetoner," <a href=""https://www.last.fm/music/Ringetoner"">Read more on Last.fm</a>",220,368,"['DJ Big Mix', 'Yossi Guetta', 'DJ ApPleMan', 'John Turner', 'Neil Haverty']"
Vani," <a href=""https://www.last.fm/music/Vani"">Read more on Last.fm</a>",1234,5584,"['Ges-e', 'Zahid', 'Arcana Obscura', 'Cinderella Effect', 'Sara Noxx']"
"Morgan, G & Machines"," <a href=""https://www.last.fm/music/Morgan,+G+&+Machines"">Read more on Last.fm</a>",9519,39925,"['Glambeats Corp.', 'Francoise Sanders', 'Urban Love', 'Sarah Menescal', 'Sao Vicente']"
Vybz Kartel,"Vybz Kartel (born Adidja Palmer, Jan. 7, 1976) is a Jamaican dancehall deejay.

He was born at Kingston's Victoria Jubilee Hospital, and was one of six children.  Originally from Waterhouse, Kingston, he was raised in the Waterford district in the community Portmore, Jamaica.  Adidja attended Calabar High School in Kingston but was expelled as a teenager.  Determined to continue his education, he completed his studies at a tutorial technical school. <a href=""https://www.last.fm/music/Vybz+Kartel"">Read more on Last.fm</a>",324630,5732392,"['Mavado', 'Popcaan', 'Alkaline', 'Aidonia', 'Konshens']"
Paul Collins,"Paul Collins was a founding member of The Nerves, a legendary underground rock group from 1974-77. (Other legendary rock groups formed in 1974, including Blondie, The Ramones, Radio Birdman and The Dictators). The Nerves were a 3-piece band featuring the talents of Jack Lee, Peter Case (The Plimsouls) and Paul Collins (The Beat). Aside from touring with The Ramones, The Nerves funded their own recordings without a record deal. The Nerves originally recorded the song Hanging On The Telephone <a href=""https://www.last.fm/music/Paul+Collins"">Read more on Last.fm</a>",14295,120270,"[""Paul Collins' Beat"", 'The Whiffs', 'Uni Boys', 'Prix', 'Tuff Darts']"
Jxxiii," <a href=""https://www.last.fm/music/jxxiii"">Read more on Last.fm</a>",350,17499,"['Don Tello', 'Joseph Wyze', 'Archie Blackie', 'DJ Gotham', 'Lofi Birds']"
My Little Pony,"My Little Pony was an indie pop/twee pop band from Oslo, Norway, formed in 2007. In 2012 the band changed its name to Making Marks.

My Little Pony also is a toy brand owned by Hasbro and created in the 1980's, but that is not an artist. <a href=""https://www.last.fm/music/My+Little+Pony"">Read more on Last.fm</a>",107562,1987309,"['CG5', 'Shadrow', 'Melanie Martinez', 'Twilight Sparkle', 'Bahari']"
Tones On Tail,"Tones on Tail was a musical side project created by Daniel Ash of Bauhaus along with Bauhaus roadie Glenn Campling in 1982. After the demise of Bauhaus in 1983, they were joined by drummer Kevin Haskins. The band folded in 1984 shortly before Ash and Haskins went on to form Love and Rockets.

Tones on Tail's music is psychedelic/surrealist with a heavy English gothic rock vibe. It is textural and introspective and exhibits Ash's characteristically clean production. <a href=""https://www.last.fm/music/Tones+on+Tail"">Read more on Last.fm</a>",191254,1879710,"['Love and Rockets', 'The Danse Society', 'Daniel Ash', 'Red Lorry Yellow Lorry', 'The Essence']"
Adam F,"DJ Adam F (Born in Liverpool, England) is a jungle/drum and bass producer and DJ. His father  pop singer Bernard William Jewry, known as Alvin Stardust.

Adam F's breakthrough hit was the techstep single Metropolis/Mother Earth, released in 1997 on the Metalheadz record label. He signed to the EMI label in the UK and in 1998 won a MOBO award for his debut album Colours, containing the UK Top 20 hits Music in my Mind, Circles and Brand New Funk. 
 <a href=""https://www.last.fm/music/Adam+F"">Read more on Last.fm</a>",250843,1890895,"['Origin Unknown', 'Alex Reece', 'Krust', 'DJ Trace', 'Roni Size']"
MR WIGGLES,"Mr Wiggles is one of the original members of the legendary Rocksteady Crew. Besides a bboy, he also is involved in graffiti and dj'in(producing) doing various workshops. Don't miss him if he comes in your town. <a href=""https://www.last.fm/music/Mr+Wiggles"">Read more on Last.fm</a>",950,8630,"['Jay-Roc', 'DJ Rockstar', 'Mr. Wiggles', 'Massive Breakz', 'Lorenz Rhode']"
Andrew McMahon in the Wilderness,"Andrew McMahon in the Wilderness is the third musical project by Andrew McMahon, the former lead singer of Something Corporate and Jack's Mannequin.

McMahon announced the moniker in a blog post in July 2014, stating, ""as I embark on yet another musical adventure, I will be traveling with my band to many of those same stages, this time as “Andrew McMahon in the Wilderness”. I suppose my wilderness is mostly an abstract one. Since putting Jack’s behind me, I have forced myself into strange spaces seeking new stimulus..."" <a href=""https://www.last.fm/music/Andrew+McMahon+in+the+Wilderness"">Read more on Last.fm</a>",227445,3675571,"[""Jack's Mannequin"", 'Something Corporate', 'The Colourist', 'The Rocket Summer', 'Walk the Moon']"
Soul-Ty,"SOUL-TY establihed in The Netherlands and Spain, is not just a band, it is a musical experience crossing all genres from Soul, Dance, R&B, Soulfull House, POP, including music from the 70′s,Funk, Disco,80′s, 90′s and today’s Top 40.

Throughout the combination and knowledge of two people, producer Ted Peters who has been working in the computer industry his whole life, and singer/songwriter Jeanet Dorothy Martherus whom is a well known singer and entertainer in the Netherlands, they’ve managed to make innovative soulful house music. <a href=""https://www.last.fm/music/Soul-Ty"">Read more on Last.fm</a>",1031,4962,"['Soulful-Cafe', 'Soulfultrance the real producers', 'Tedjep Soulful House', 'DEEP X', 'Bahia de Roses']"
Crucified Barbara,"Crucified Barbara was a Swedish band formed in 1998. They played a mixture of heavy metal, sleaze rock and hard rock.

They released two singles in 2005 (Losing The Game and Rock N' Roll Bachelor) before releasing their debut album In Distortion We Trust the same year. This was followed up by a new single (Play Me Hard) in 2006.

Their second album 'Til Death Do Us Party was released in February 2009. The only single off that album was Jennyfer, a track featuring Mats Levén on vocals who also partly produced the album. <a href=""https://www.last.fm/music/Crucified+Barbara"">Read more on Last.fm</a>",49302,1365007,"['Sister Sin', 'Dee Snider', 'Chrome Division', 'Doro', 'Burning Witches']"
Coro Cantores de Madrid," <a href=""https://www.last.fm/music/Coro+Cantores+de+Madrid"">Read more on Last.fm</a>",287,1445,"['Coros Cantores De Madrid', 'Gran Orquesta Sinfonica', 'Gerardo Monreal', 'Coro De Camara Del Orfeon Donostiarra', 'Ataúlfo Argenta']"
John Story," <a href=""https://www.last.fm/music/John+Story"">Read more on Last.fm</a>",20348,182672,"['Steven Current', 'Dominick Maita', 'Teddy Aspra', 'Parker Zion', 'The Hakumoshee Sound']"
Barrence Whitfield & The Savages,"Barrence Whitfield (born Barry White, raised in New Jersey) has been singing with The Savages for decades. They first appeared on record with a self-titled debut in 1984 (Mamou label, since reissued by Ace UK). Their most recent releases are Savage Kings (Munster 2011) and Dig Thy Savage Soul (Bloodshot 2013). Their specialty is capturing the energy of early rock 'n' roll, R&B, and jump blues. Barrence continues to appear and record with the Savages. <a href=""https://www.last.fm/music/Barrence+Whitfield+&+the+Savages"">Read more on Last.fm</a>",11393,105408,"['Barrence Whitfield', 'Nikki Hill', 'Black Joe Lewis', 'Dave Alvin & Phil Alvin', 'The Juke Joint Pimps']"
The Royal French Orchestra," <a href=""https://www.last.fm/music/The+Royal+French+Orchestra"">Read more on Last.fm</a>",3113,16564,"['Night Rhythm', 'Poco Loco', 'Dance 4 Color', 'Snipers', 'New Limit']"
Lloyd Luther," <a href=""https://www.last.fm/music/Lloyd+Luther"">Read more on Last.fm</a>",7295,65977,"['Ay Em', 'D Power Diesle', 'Big Zuu', 'Ambush Buzzworl', 'Ard Adz']"
The Monochrome Set,"The Monochrome Set are an English post-punk band originally formed in 1978 from the remnants of a college group called The B-Sides (whose members had included Stuart Goddard, a.k.a. Adam Ant). The band is notable for its witty lyrics, the laconic delivery of lead singer Bid, and the idiosyncratically retrogressive playing style of original lead guitarist Lester Square.
 
The original line-up consisted of Indian born lead singer and principal songwriter Bid (real name Ganesh Seshadri), Canadian guitarist Lester Square (real name Thomas W. <a href=""https://www.last.fm/music/The+Monochrome+Set"">Read more on Last.fm</a>",122435,1580076,"['Josef K', 'Orange Juice', 'Television Personalities', 'The Teardrop Explodes', 'Blue Orchids']"
El Carbonerillo," <a href=""https://www.last.fm/music/El+Carbonerillo"">Read more on Last.fm</a>",258,1654,"['José Cepero', 'Manuel Vallejo', 'José Palanca', 'Corruco de Algeciras', 'Antonio Chacón']"
Lil Jon,"Jonathan Mortimer Smith (born January 27, 1971 in Atlanta, Georgia), better known by his stage name Lil Jon, is an American rapper, actor, producer and member of the crunk group Lil Jon & The East Side Boyz. Lil Jon formed the group with friends Big Sam and Lil Bo, and they released five studio albums and have had many hit songs. He's prehaps best known for his iconic single ""Get Low"", which featured the Ying Yang Twins and reached #2 on the Billboard 100. He released his debut solo album, 'Crunk Rock', in June 2010. <a href=""https://www.last.fm/music/Lil+Jon"">Read more on Last.fm</a>",772687,4563614,"['Lil Jon & The East Side Boyz', 'Ying Yang Twins', 'LMFAO', 'Ludacris', 'T.I.']"
Kaydy Cain,"Daniel Gómez Carrero (Dani Gómez; born 12 February 1990), known professionally as Kaydy Cain, is a Spanish rapper and former member of the music group Pxxr Gvng (pronounced as poor gang; later known as Los Santos). He is recognised for his original style and his contributions to the explosion of the genre trap in Spain.

Dani Gómez began his artistic journey in the 2010s as a member of the trap group Pxxr Gvng, with which he was able to turn his life around thanks to the popularity that hip hop began to enjoy in Spain <a href=""https://www.last.fm/music/Kaydy+Cain"">Read more on Last.fm</a>",81069,2615738,"['La Mafia del Amor', 'Yung Beef', 'PXXR GVNG', 'Soto Asa', 'Los Santos']"
Emcee Fandom," <a href=""https://www.last.fm/music/Emcee+Fandom"">Read more on Last.fm</a>",411,1236,"['The Young Masters of the Universe', ""Compton's Most Dangerous MC"", 'The Stratton Stars', 'Fiddy 9', ""The Rubix Cube's""]"
Kadebostany,"New colonists of the pop empire, Kadebostany have swiftly catapulted themselves into the spotlight with their irresistible blend of pop music devouring unlikely influences to create a singular yet terribly catchy universe of its own. A striking visual identity and their infamously powerful live performances backed by an exclusive visual show perfect the experience. Bearing both a solid artistic credibility and an evident potential for broad appeal, Kadebostany are set to stand as undisputed heralds of a renewal in the pop music world. <a href=""https://www.last.fm/music/Kadebostany"">Read more on Last.fm</a>",134237,1803553,"['Alexiane', 'MARUV', 'FILV', 'Ева Польна', 'Monaldin']"
Greg Hatwell," <a href=""https://www.last.fm/music/Greg+Hatwell"">Read more on Last.fm</a>",2742,16509,"['Patrick Joseph', 'Laura Zocca', 'Marc Lane', 'Paweł Domagała', 'Kevin Daniel']"
Klooz,"KlOOZ, (鯨井康夫 - Kujirai Yasuo, born on August 15th, 1984) is a hip hop MC currently signed to the 'DREAM BOY' record label created by fellow Japanese rapper, KEN THE 390

OHP: http://ameblo.jp/klooz3156/ <a href=""https://www.last.fm/music/KLOOZ"">Read more on Last.fm</a>",1302,28331,"['AKLO', 'SALU', 'KEN THE 390', 'RAU DEF', 'NORIKIYO']"
K-Rhyme Le Roi," <a href=""https://www.last.fm/music/K-Rhyme+le+Roi"">Read more on Last.fm</a>",2007,6938,"['Le Rat Luciano', 'Chiens De Paille', 'Pit Baccardi', 'Rocca', '2 BAL']"
Blue Claw Philharmonic," <a href=""https://www.last.fm/music/Blue+Claw+Philharmonic"">Read more on Last.fm</a>",10393,52328,"['Dubstep Hitz', 'We Are One', 'Mykies McFilthy', 'Rednek', 'OktoRed']"
Czesław Śpiewa,"Czesław Śpiewa (pol. ""Czesław Sings"") (born Czesław Mozil, April 12, 1979 in Zabrze, Poland) is a singer, composer, and musician (mostly using the accordion). He makes hard-to-classify music, with pieces of cabaret, rock, even punk rock.

Mozil graduated Royal Danish Academy of Music after he had moved to Copenhagen at the age of 5. He began his career in 2000 as a vocalist of the band Tesco Value. After several successes in Denmark, including concerts at Roskilde Festival and Copenhagen Jazz Fest <a href=""https://www.last.fm/music/+noredirect/Czes%C5%82aw+%C5%9Apiewa"">Read more on Last.fm</a>",138635,8804954,"['Strachy Na Lachy', 'Raz, Dwa, Trzy', 'Kult', 'Lao Che', 'Hey']"
NANO,"There is more than one artist under this name:

1. NANO is HAKUEI and 千聖's (Chisato) side project, mostly dedicated to remixing old PENICILLIN songs, but they have also recorded a few completely new songs. 
In 2006, NANO have released seven singles and one album, unborn child's dream. The DVD versions of each single and the album contain one episode of ドグラ・マグラ (Dogura Magura).

2. Nano ナノ (born on July, 1988 in New York) is a Japanese singer and songwriter. <a href=""https://www.last.fm/music/Nano"">Read more on Last.fm</a>",132239,2600187,"['鈴木このみ', 'ナノ', 'STEREO DIVE FOUNDATION', 'Flow', ""ROOKiEZ is PUNK'D""]"
Dawkins Nathaniel," <a href=""https://www.last.fm/music/Dawkins+Nathaniel"">Read more on Last.fm</a>",3741,20451,"['Erba Tom', 'STIC.MAN Of Dead Prez (AKA) Stic', 'Trackrunners', 'T. Powell', 'Ronnie Coleman']"
Nickelback,"Nickelback is a rock band which formed in Hanna, Alberta, Canada in 1995. Nickelback is one of the most commercially successful Canadian groups, having sold 50 million records worldwide. Nickelback ranks as the 7th best selling music act of the 2000s and the 2nd best selling foreign act in the US behind The Beatles for the 2000s.

The band consists of Chad Kroeger (vocals, guitar), Ryan Peake (guitar, vocals), Mike Kroeger (bass) and Daniel Adair (drums). <a href=""https://www.last.fm/music/Nickelback"">Read more on Last.fm</a>",3792841,116254451,"['Theory of a Deadman', '3 Doors Down', 'Hinder', 'Daughtry', 'Shinedown']"
Skank,"Skank is a pop/rock/reggae band in Brazil. The band started 1991, in Belo Horizonte, Minas Gerais.

The debut album, Skank (1993), was successful around the underground circuit. The second album, ""Calango"", came out in 1994 . “É Proibido Fumar”, “Te Ver”, “Pacato Cidadão”, “Jackie Teckila” and “Esmola” were the biggest hits.

In 1996, “Garota Nacional”, the single of ""O Samba Poconé"" gave Skank international success. The band travelled around the world, performing in Latin America, United States and Europe. <a href=""https://www.last.fm/music/Skank"">Read more on Last.fm</a>",558384,17668782,"['Jota Quest', 'Os Paralamas Do Sucesso', 'Capital Inicial', 'Frejat', 'Detonautas Roque Clube']"
Amphibious Zoo Music," <a href=""https://www.last.fm/music/Amphibious+Zoo+Music"">Read more on Last.fm</a>",10904,73874,"['Powers', 'Merk & Kremont', 'Speed Up', 'Countdown Singers', 'Макс Корж']"
Indiefolktrion," <a href=""https://www.last.fm/music/Indiefolktrion"">Read more on Last.fm</a>",27,227,"['Hazelius Hedin', 'Esbjörn Hazelius', 'Klabbes Bank', 'Johan Airijoki', 'Mattias Alkberg']"
La Banda del Musiquero Loco," <a href=""https://www.last.fm/music/La+Banda+del+Musiquero+Loco"">Read more on Last.fm</a>",933,5274,"['Bubba y sus amigos', 'Adriana Szuster', 'Nora Galit', 'Las Tortuguitas', 'Fede petro']"
Hank Sundown & The Roaring Cascades," <a href=""https://www.last.fm/music/Hank+Sundown+&+The+Roaring+Cascades"">Read more on Last.fm</a>",1576,16109,"['THE UNKOOL HILLBILLIES', 'Johnny & The Jailbirds', 'John Whiteleather', 'Runaway Boys', 'The Top Cats']"
Los Vasquez," <a href=""https://www.last.fm/music/Los+Vasquez"">Read more on Last.fm</a>",23781,386518,"['noche de brujas', 'Santaferia', 'La Noche', 'Américo', 'Chico Trujillo']"
Fito Paez,"PUT THE CORRECT ARTIST NAME: Fito Páez

 <a href=""https://www.last.fm/music/+noredirect/Fito+Paez"">Read more on Last.fm</a>",126312,5533296,[]
Non Servium,"Oi! band from Madrid, Spain active from 1997 to 2019. they recorded six studio albums and their lyrics used to deal themes such as: anti-fascism, football, violence, beer... and other topics of the genre. <a href=""https://www.last.fm/music/Non+Servium"">Read more on Last.fm</a>",25376,729878,"[""Lion's Law"", 'Kaos Urbano', 'Acidez', 'Los Fastidios', 'Bishops Green']"
Red Sky Lullaby,"Red Sky Lullaby is Stuart Kilbride and Guest Vocalists

TRACKS:
1) With You Again (Vocals by Elspeth Eastman)
2) Somebody (Vocals by Elspeth Eastman)
3) Shadows (Vocals by Kalu James)
4) Herbal Essence <a href=""https://www.last.fm/music/Red+Sky+Lullaby"">Read more on Last.fm</a>",1056,5054,"['sharkara', 'Sunday Radio', 'Quebec Antique', 'Noise bleed', 'Fire Flower Revue']"
W.E.S.," <a href=""https://www.last.fm/music/W.E.S."">Read more on Last.fm</a>",81,287,"['Rebels to the Grain', 'Rize & Kronos', 'ed/ge', 'Fisto', 'S.MOS']"
Kingdom 2," <a href=""https://www.last.fm/music/Kingdom+2"">Read more on Last.fm</a>",515,2730,"['Patrick David Aubry, Kevin Cook & Douglas Shawn Wooldridge', 'Robert Charles Mann', 'Chris Didlick', 'Dan Reid', 'Charles Dixon']"
O.A.R.,"O.A.R. (Of A Revolution) is an alternative rock band which formed in Rockville, Maryland, United States in 1996. The band consists of Marc Roberge (vocals, guitar), Chris Culos (drums, percussion), Richard On (guitar, backing vocals), Benj Gershman (bass), and Jerry DePizzo (saxophone, guitar, backing vocals). The band has released seven albums: ""The Wanderer"" (1997), Soul's Aflame (2000), ""Risen"" (2001), ""In Between Now and Then"" (2003), ""Stories of a Stranger"" (2005), ""All Sides"" (2008), and King (2011).  <a href=""https://www.last.fm/music/O.A.R."">Read more on Last.fm</a>",536479,8503692,"['Dispatch', 'Dave Matthews', 'Dave Matthews Band', 'Sister Hazel', 'Better Than Ezra']"
Michael Marc," <a href=""https://www.last.fm/music/Michael+Marc"">Read more on Last.fm</a>",17517,93952,"['United Guitar Players', 'Peter Pupping', 'Instrumental Guitar Masters', 'Joseph Sullinger', 'Georg Erixon']"
Ramon," <a href=""https://www.last.fm/music/Ramon"">Read more on Last.fm</a>",6257,32941,"['Ramón del Castillo', 'David Civera', 'Guri Schanke', 'Severine', ""D'Nash""]"
SATV Music,"SATV Music is a premium music library with the media industry at its core. As one of the only music services developed from the inside, we know how to create quality music that is usable, ahead of the curve and bang on brief.

We work with a diverse and ever-expanding range of artists and composers to deliver music internationally across the whole media industry. Our high production standards and industry knowledge will ensure that no more time is wasted scrolling through South American pan pipes 1 <a href=""https://www.last.fm/music/SATV+Music"">Read more on Last.fm</a>",35153,404168,"['Boris Nonte', 'Oh The Larceny', 'Reynard Seidel', 'Tommee Profitt', 'JAXSON GAMBLE']"
Lluís Coloma," <a href=""https://www.last.fm/music/+noredirect/Llu%C3%ADs+Coloma"">Read more on Last.fm</a>",811,6302,"['Lluís Coloma Trio', 'Bob Seeley', 'Caroline Dahl', 'James Goodwin', 'Chris Banta']"
Joey Peters," <a href=""https://www.last.fm/music/Joey+Peters"">Read more on Last.fm</a>",184,953,"['Jim Bacchi', 'Dierdre Dubois & Daniel J. Nielsen', 'Jennifer Hammond', 'Daniel J. Nielsen & Jennifer Hammond', 'Daniel Jay Nielsen']"
Dynamic Duo,"1) Swiss Hip-Hop group that consists of members Spooman and Shape. They rap in the Swiss dialect.

2) Dynamic Duo (다이나믹 듀오) are a South Korean Hip-Hop duo. Made of members 개코 (Gaeko) and 최자 (Choiza), who were members of the former trio CB Mass.

They debuted as part of KOD in 2000, but the two later formed CB Mass along with 커빈 (Curbin). However, the group separated in 2003 because of financial troubles caused by Curbin. Later, Choiza and Gaeko announced in 2004 the group Dynamic Duo, and they are active until present. <a href=""https://www.last.fm/music/Dynamic+Duo"">Read more on Last.fm</a>",45689,1002025,"['Epik High', 'Primary', 'pH-1', 'Simon Dominic', 'ZICO']"
Tabata Songs," <a href=""https://www.last.fm/music/Tabata+Songs"">Read more on Last.fm</a>",17534,313960,"['Tabata music', 'Power Music Workout', 'Workout Remix Factory', 'Hard EDM Workout', 'byor']"
Amazonics," <a href=""https://www.last.fm/music/Amazonics"">Read more on Last.fm</a>",78493,489364,"['Michelle Simonal', 'Urban Love', 'Groove Da Praia', 'Sarah Menescal', 'Ituana']"
John Logan Band," <a href=""https://www.last.fm/music/John+Logan+Band"">Read more on Last.fm</a>",4,4,[]
Hr Bristol," <a href=""https://www.last.fm/music/Hr+Bristol"">Read more on Last.fm</a>",1787,5923,"['Ht Bristol', 'Mountains vs. Machines', 'Brave the Royals', 'SaYsH', 'American Wolves']"
